{
  "end_version_commit": "",
  "gold_patch": "",
  "metadata": {
    "manifest_sha256": "80b07f228dce5463f658ac95dd48055d2b7cd2e1527f0c1c2f3c975d5a6ab963",
    "source_task_id": "complex/nbnxn-free-energy"
  },
  "prs": [],
  "source": "gromacs-regressiontests",
  "source_id": "gromacs-nbnxn-free-energy"
}
