{
  "source": "ParaView public regression test",
  "source_id": "paraview-color-histogram-selection",
  "end_version_commit": "799b56e5304a7fbe2b18263328310707f64e6aa0",
  "gold_patch": "",
  "prs": [],
  "metadata": {
    "source_task_id": "Clients/ParaView/Testing/Python/TestColorHistogram.py",
    "revision": "799b56e5304a7fbe2b18263328310707f64e6aa0"
  }
}
